{
  "id": "ord_000001",
  "client_order_id": "client_000001",
  "symbol": "BTC-USD",
  "side": "buy",
  "type": "limit",
  "status": "new",
  "price": 50000.25,
  "quantity": 1.5,
  "filled_quantity": 0,
  "remaining_quantity": 1.5,
  "leaves_quantity": 1.5,
  "cumulative_quote_quantity": 0,
  "avg_price": 0,
  "time_in_force": "gtc",
  "created_at": "2026-06-19T06:45:00Z",
  "updated_at": "2026-06-19T06:45:00Z"
}
