{
  "id": "ord_20260619_000001",
  "client_order_id": "client_7d2f6f0e",
  "symbol": "BTC_USDT",
  "side": "buy",
  "type": "limit",
  "status": "partially_filled",
  "price": "65000.00",
  "quantity": "0.50000000",
  "filled_quantity": "0.12500000",
  "remaining_quantity": "0.37500000",
  "leaves_quantity": "0.37500000",
  "cumulative_quote_quantity": "8125.00",
  "avg_price": "65000.00",
  "time_in_force": "gtc",
  "created_at": "2026-06-19T05:58:30Z",
  "updated_at": "2026-06-19T06:02:11Z"
}
