{
  "id": "ord_000042",
  "client_order_id": "client_000042",
  "symbol": "BTC/USD",
  "side": "buy",
  "type": "limit",
  "status": "new",
  "price": "50000.00",
  "quantity": "1.5",
  "filled_quantity": "0.0",
  "remaining_quantity": "1.5",
  "leaves_quantity": "1.5",
  "cumulative_quote_quantity": "0.00",
  "avg_price": "0.00",
  "time_in_force": "gtc",
  "created_at": "2026-01-15T10:30:00Z",
  "updated_at": "2026-01-15T10:30:00Z"
}